{
  "$schema": "https://json-schema.org/draft/2020-12/schema",
  "$id": "https://macro-regime.local/schemas/e14-external-authority-provisioning-preregistration-v1.json",
  "type": "object",
  "additionalProperties": false,
  "required": ["schemaVersion", "artifactType", "phaseId", "boundaryReviewSha256", "scope", "requiredCapabilities", "requiredProvisioningEvidence", "gates", "nextAllowedAction"],
  "properties": {
    "schemaVersion": {"const": 1},
    "artifactType": {"const": "E14ExternalAuthorityProvisioningPreregistration"},
    "phaseId": {"const": "E14.8"},
    "boundaryReviewSha256": {"const": "2c561b61fb84722310e61ee9a3ff08a948cd81cf7d1edcc5e4c1818dbb7c9662"},
    "scope": {
      "type": "object", "additionalProperties": false,
      "required": ["designOnly", "providerSelected", "remoteResourcesCreated", "credentialsCreated", "runtimeCodeChanged", "networkRequestsMade"],
      "properties": {
        "designOnly": {"const": true}, "providerSelected": {"const": false}, "remoteResourcesCreated": {"const": false},
        "credentialsCreated": {"const": false}, "runtimeCodeChanged": {"const": false}, "networkRequestsMade": {"const": 0}
      }
    },
    "requiredCapabilities": {
      "type": "object", "additionalProperties": false,
      "required": ["externalToCopyableWorkspace", "deploymentIdentityBound", "immutableDeploymentPin", "closedContractValidation", "mutualAuthentication", "leastPrivilege", "authenticatedCompareAndSwap", "crossDeploymentMonotonicity", "coordinatedRollbackPrevention", "idempotentOperations", "readAfterWriteVerification", "pendingCommittedRecovery", "postRenameRecovery", "crossVolumePreflight", "directoryDurability", "descriptorNoFollowReads", "processStartLockIdentity", "tamperEvidentReceipts"],
      "properties": {
        "externalToCopyableWorkspace": {"const": true}, "deploymentIdentityBound": {"const": true}, "immutableDeploymentPin": {"const": true},
        "closedContractValidation": {"const": true}, "mutualAuthentication": {"const": true}, "leastPrivilege": {"const": true},
        "authenticatedCompareAndSwap": {"const": true}, "crossDeploymentMonotonicity": {"const": true}, "coordinatedRollbackPrevention": {"const": true},
        "idempotentOperations": {"const": true}, "readAfterWriteVerification": {"const": true}, "pendingCommittedRecovery": {"const": true},
        "postRenameRecovery": {"const": true}, "crossVolumePreflight": {"const": true}, "directoryDurability": {"const": true},
        "descriptorNoFollowReads": {"const": true}, "processStartLockIdentity": {"const": true}, "tamperEvidentReceipts": {"const": true}
      }
    },
    "requiredProvisioningEvidence": {
      "type": "array", "minItems": 8, "uniqueItems": true,
      "items": {"enum": ["provider-identity", "endpoint-identity", "certificate-or-key-fingerprints", "tenant-and-deployment-binding", "access-policy", "retention-and-rollback-policy", "failure-injection-report", "operations-owner", "incident-runbook", "deprovisioning-plan"]}
    },
    "gates": {
      "type": "object", "additionalProperties": false,
      "required": ["independentDesignReviewPassed", "providerSelected", "credentialsProvisioned", "endpointReachable", "adapterImplemented", "failureModesPassed", "externalProvisioningAuthorized", "providerNetworkAuthorized", "productionPublicationAuthorized", "discoveryCatalogAuthorized", "executionGateAuthorized", "sourceAcquisitionAuthorized", "downstreamAuthorized"],
      "properties": {
        "independentDesignReviewPassed": {"const": false}, "providerSelected": {"const": false}, "credentialsProvisioned": {"const": false},
        "endpointReachable": {"const": false}, "adapterImplemented": {"const": false}, "failureModesPassed": {"const": false},
        "externalProvisioningAuthorized": {"const": false}, "providerNetworkAuthorized": {"const": false}, "productionPublicationAuthorized": {"const": false},
        "discoveryCatalogAuthorized": {"const": false}, "executionGateAuthorized": {"const": false}, "sourceAcquisitionAuthorized": {"const": false},
        "downstreamAuthorized": {"const": false}
      }
    },
    "nextAllowedAction": {"const": "E14.8a independent review of this design-only provisioning preregistration; no provider selection, provisioning, network access, adapter implementation or publication is authorized."}
  }
}
